{"$schema":"https://json-schema.org/draft/2020-12/schema","title":"Build Repository Watchdog Specification","type":"object","additionalProperties":false,"required":["schema_version","watchdog_id","runtime_control_authority","source_control_authority","authorized_repository","authorized_external_targets","schedule","audit_layers","detector_states","finding_lifecycle_states","deep_audit_states","severity_states","allowed_predicate_ops","read_failure","issue_mutation","self_audit","audit_scope","notification_events","daily_summary_rule","mutation_boundary"],"properties":{"schema_version":{"const":1},"watchdog_id":{"const":"build-repository-watchdog-v1"},"runtime_control_authority":{"const":"NONE"},"source_control_authority":{"const":"NONE"},"authorized_repository":{"type":"object"},"authorized_external_targets":{"type":"object"},"schedule":{"type":"object"},"audit_layers":{"type":"array","minItems":3,"uniqueItems":true},"detector_states":{"type":"array","minItems":6,"uniqueItems":true},"finding_lifecycle_states":{"type":"array","minItems":3,"uniqueItems":true},"deep_audit_states":{"type":"array","minItems":3,"uniqueItems":true},"severity_states":{"type":"array","minItems":4,"uniqueItems":true},"allowed_predicate_ops":{"type":"array","minItems":1,"uniqueItems":true},"read_failure":{"type":"object"},"issue_mutation":{"type":"object"},"self_audit":{"type":"object"},"audit_scope":{"type":"object"},"notification_events":{"type":"array","minItems":1,"uniqueItems":true},"daily_summary_rule":{"const":"SEND_ON_LOCAL_HOUR_14_DEEP_AUDIT_ONLY"},"mutation_boundary":{"type":"object"}}}
